1,HD81-2506-15Cc,2,Corrupti quisquam tempore hic maiores reprehenderit iusto eveniet. Voluptates facere laudantium sunt ad recusandae animi. Et quia esse.,Explicabo cum ut necessitatibus libero. Aperiam ea earum illo nobis. A quia voluptatem error delectus molestiae.
2,Qp97-8045-20ok,0,Quod fuga quae consequuntur ut corporis consequuntur. Voluptatibus voluptate perferendis natus itaque.,"Sapiente asperiores esse totam illum.
Optio reiciendis corporis sed atque. Porro natus explicabo laboriosam."
0,RT26-0416-09nv,1,Dolorem eius blanditiis iste cum consequatur porro quam. Vel ad labore laudantium id laborum.,Quae alias perferendis laudantium molestias minus adipisci. Culpa sit suscipit minus excepturi delectus saepe.
1,HD81-2506-15Cc,2,Corrupti quisquam tempore hic maiores reprehenderit iusto eveniet. Voluptates facere laudantium sunt ad recusandae animi. Et quia esse.,Explicabo cum ut necessitatibus libero. Aperiam ea earum illo nobis. A quia voluptatem error delectus molestiae.
0,xY16-7402-83ht,2,"Asperiores fugiat molestias suscipit. Laudantium nemo id omnis sunt ipsum quia.
Illum numquam vel. Atque fugiat accusamus in dolore voluptatibus nulla.","Eum ea in magnam. Repudiandae illo perferendis distinctio libero accusantium.
Temporibus exercitationem sequi perferendis. Ratione ipsam possimus magnam totam."